id,name,slug,parent_id,description,is_active,created_at,created_by,updated_at,updated_by,deleted_at
1,Plumbing,plumbing-and-water,,"Pipe repair, installations and leak detection.",true,2025-11-07 12:00:00,1,2025-11-07 12:00:00,1,
2,Electrical,electrical-work,,"Wiring, repair and fault fixing.",true,2025-11-07 12:00:00,1,2025-11-07 12:00:00,1,
3,Painting,painting-and-decor,,Interior and exterior and specialized painting.,true,2025-11-07 12:00:00,1,2025-11-07 12:00:00,1,
4,Home Services,home-general,,General home services.,true,2025-11-07 12:00:00,1,2025-11-07 12:00:00,1,
5,Logistics,logistics,,Packing and moving services.,true,2025-11-07 12:00:00,1,2025-11-07 12:00:00,1,
6,IT & Software,it-and-web,,"IT support, networking and web dev.",true,2025-11-07 12:00:00,1,2025-11-07 12:00:00,1,
